{
  "artifact_type": "USER_MERGE_AUTHORIZATION",
  "authorization_version": 2,
  "owner": "USER",
  "decision": "ALLOW_MERGE",
  "merge_candidate_freeze_digest": "6c1ca6b831827c19648c891b3341352e29cd91188935ad9d3418d6cb14780070",
  "user_acceptance_capsule_digest": "2abeadc0e39ab4db86987f037e0eadc46eb573ae7fadb8a7d0a28348a8560479",
  "decision_ref": "conversation:current-explicit-user-merge-authorization",
  "authorization_digest": "10335711c0001b1db5f121d2f478b1fcdce0310e763f10ec959496219b213bd2"
}
